[
  {
    "id": "A001",
    "earlier_claim": "The region has a history far older than the state formed in 1956.",
    "verdict": "supported",
    "corrected_treatment": "Retain, distinguishing planetary, geological, archaeological and administrative histories.",
    "sources": [
      "S001",
      "S023"
    ]
  },
  {
    "id": "A002",
    "earlier_claim": "Edakkal engravings date to around 6000 BCE.",
    "verdict": "overprecise_withdraw",
    "corrected_treatment": "Record 6000 BCE as the tourism page’s attribution, not an established absolute date.",
    "sources": [
      "S011",
      "S012"
    ]
  },
  {
    "id": "A003",
    "earlier_claim": "Edakkal establishes people living there about 8000 years ago.",
    "verdict": "not_established",
    "corrected_treatment": "This calculation inherits the unverified 6000 BCE premise; do not make it a dated occupation fact.",
    "sources": [
      "S011",
      "S012"
    ]
  },
  {
    "id": "A004",
    "earlier_claim": "Edakkal is the oldest widely cited prehistoric evidence / an appropriate earliest-human start.",
    "verdict": "misleading_ranking",
    "corrected_treatment": "No bibliometric oldest-widely-cited ranking was established. Investigate earlier stone-tool evidence independently.",
    "sources": [
      "S009",
      "S012"
    ]
  },
  {
    "id": "A005",
    "earlier_claim": "Edakkal is a cave in Wayanad.",
    "verdict": "qualify",
    "corrected_treatment": "The conventional place name is retained; the physical setting is a natural rock shelter/cleft, not necessarily a solution cave.",
    "sources": [
      "S012"
    ]
  },
  {
    "id": "A006",
    "earlier_claim": "Its pictures depict humans, animals, symbols and everyday activities.",
    "verdict": "partly_supported",
    "corrected_treatment": "Human/animal-like forms and signs can be catalogued; everyday activity and meaning are interpretations, not automatically identifiable facts.",
    "sources": [
      "S012"
    ]
  },
  {
    "id": "A007",
    "earlier_claim": "The engravings belong to different periods.",
    "verdict": "qualify",
    "corrected_treatment": "Multiple additions are a scholarly interpretation; panel-by-panel dates are not supplied by this audit.",
    "sources": [
      "S012"
    ]
  },
  {
    "id": "A008",
    "earlier_claim": "Earlier human activity than Edakkal is possible.",
    "verdict": "supported_as_research_direction",
    "corrected_treatment": "The 2016 abstract is a concrete lead to reported Lower Palaeolithic evidence; it does not determine the first occupation date.",
    "sources": [
      "S009"
    ]
  },
  {
    "id": "A009",
    "earlier_claim": "Ashoka’s inscriptions provide a third-century BCE documentary anchor.",
    "verdict": "supported_with_scope_limit",
    "corrected_treatment": "Retain as an early external reference, not proof of the earliest conceivable record about any place inside the territory.",
    "sources": [
      "S014"
    ]
  },
  {
    "id": "A010",
    "earlier_claim": "Approximately 250 BCE is a firm starting point.",
    "verdict": "overprecise_withdraw",
    "corrected_treatment": "Use a third-century horizon. The inspected translator proposes 257 BCE; retain that as attributed dating, not a universal exact start.",
    "sources": [
      "S014"
    ]
  },
  {
    "id": "A011",
    "earlier_claim": "Keralaputra / Kedalaputo are interchangeable exact transcriptions.",
    "verdict": "critical_edition_pending",
    "corrected_treatment": "Preserve witness-specific spellings and scripts. Hultzsch 1925 reads Girnar Ketalaputo, Kalsi Ke[lala]puto, Shahbazgarhi Keradaputro and Mansehra Keralaputra. The form Kedalaputo was not found in Hultzsch and needs its edition identified. Compare later critical editions before normalizing.",
    "sources": [
      "S014",
      "S015"
    ]
  },
  {
    "id": "A012",
    "earlier_claim": "Keralaputras are generally associated with Cheras.",
    "verdict": "further_epigraphic_review",
    "corrected_treatment": "Do not translate this conventional identification into proof of exact territory, dynasty chronology or modern identity. The full identification literature has not been audited. Rock Edict XIII names Chodas, Pandyas and Tamraparni but not the Keralaputras (S014; S015 p. xxxix); record this absence without drawing an inference.",
    "sources": [
      "S014",
      "S015"
    ]
  },
  {
    "id": "A013",
    "earlier_claim": "The Ashokan reference establishes Mauryan control of Kerala.",
    "verdict": "not_claimed_but_guardrail",
    "corrected_treatment": "The inspected Edict II translation names these peoples beyond the ruler’s borders; do not infer annexation.",
    "sources": [
      "S014",
      "S015"
    ]
  },
  {
    "id": "A014",
    "earlier_claim": "Sangam literature can be used to reconstruct early Chera history.",
    "verdict": "research_agenda_valid",
    "corrected_treatment": "Collect individual poems, editions, layers, proposed dates and place identifications. The corpus was not verified in this pass.",
    "sources": []
  },
  {
    "id": "A015",
    "earlier_claim": "Sangam poems provide exact event dates or a single compositional date.",
    "verdict": "not_established",
    "corrected_treatment": "No such precision was justified. Keep text composition, redaction and surviving witness separate.",
    "sources": []
  },
  {
    "id": "A016",
    "earlier_claim": "The Periplus is a first-century CE Greek-language trade account.",
    "verdict": "supported",
    "corrected_treatment": "The inspected edition supports the general period and port/trade content. No exact composition year adopted.",
    "sources": [
      "S016"
    ]
  },
  {
    "id": "A017",
    "earlier_claim": "Pliny gives relevant Kerala-coast evidence.",
    "verdict": "primary_passage_inspected_in_translation",
    "corrected_treatment": "Natural History 6.26 read in the 1855 Bostock and Riley translation: Muziris as the nearest mart of India, pirates near Nitrias, a distant anchorage, king Caelobothras. The Latin text and a modern translation remain to be checked. Muziris stays a textual name.",
    "sources": [
      "S046"
    ]
  },
  {
    "id": "A018",
    "earlier_claim": "Ptolemy’s work is relevant to the second-century record.",
    "verdict": "partly_verified",
    "corrected_treatment": "The research institution supports the second-century date of the Geography. Geography 7.1.8 (Mouziris, an emporium) and 7.1.86 (Karoura, royal seat of Kerobothros) were inspected in OCR of McCrindle’s 1885 English translation and commentary. McCrindle, following Yule, identified Mouziris with Kodungallur and Karoura with Karur in Tamil Nadu. These remain attributed identifications; original Greek, scan images and a modern critical edition were not verified. Ptolemy’s coordinates are not modern positions.",
    "sources": [
      "S041",
      "S047"
    ]
  },
  {
    "id": "A019",
    "earlier_claim": "Greek/Roman trade evidence shows early maritime connections.",
    "verdict": "supported_with_limits",
    "corrected_treatment": "Texts and ceramics support exchange; they do not prove all visiting or resident people were Roman, or settle every port coordinate.",
    "sources": [
      "S016",
      "S018"
    ]
  },
  {
    "id": "A020",
    "earlier_claim": "Kerala was formed on 1 November 1956.",
    "verdict": "supported_primary",
    "corrected_treatment": "Sections 2(a) and 5 of the 1956 Act support the appointed day.",
    "sources": [
      "S023"
    ]
  },
  {
    "id": "A021",
    "earlier_claim": "The modern physical landscape has developed over geological time.",
    "verdict": "supported_broadly",
    "corrected_treatment": "Retain the distinction between basement history, topography, sedimentation and modern administrative boundaries.",
    "sources": [
      "S004",
      "S005",
      "S023"
    ]
  },
  {
    "id": "A022",
    "earlier_claim": "Earth formed approximately 4.54 billion years ago.",
    "verdict": "supported",
    "corrected_treatment": "Use as global context only, not a local sample age.",
    "sources": [
      "S001"
    ]
  },
  {
    "id": "A023",
    "earlier_claim": "Southern Kerala includes an ancient crystalline geological foundation.",
    "verdict": "supported_but_dates_qualified",
    "corrected_treatment": "Relevant geochronology exists. Sample-level ages are not adopted until corrections and analytical context are checked.",
    "sources": [
      "S002",
      "S003"
    ]
  },
  {
    "id": "A024",
    "earlier_claim": "The oldest rock beneath Kerala has a single already-established age.",
    "verdict": "not_established",
    "corrected_treatment": "No oldest-material ranking was resolved. Separate measured ages, inherited grains and crustal model ages.",
    "sources": [
      "S002",
      "S003",
      "S006"
    ]
  },
  {
    "id": "A025",
    "earlier_claim": "Part I can end and Part II begin at 250 million years ago.",
    "verdict": "editorial_only",
    "corrected_treatment": "This is a proposed book division, not an observed Kerala-specific boundary. Replace with process-based dossiers.",
    "sources": []
  },
  {
    "id": "A026",
    "earlier_claim": "Trivandrum Block research is relevant to Gondwana assembly.",
    "verdict": "supported_at_abstract_level",
    "corrected_treatment": "Retain the connection as the authors’ interpretation; full geochronological evaluation remains pending.",
    "sources": [
      "S002",
      "S003"
    ]
  },
  {
    "id": "A027",
    "earlier_claim": "Gondwana assembly and India’s later separations are the same episode.",
    "verdict": "not_claimed_but_guardrail",
    "corrected_treatment": "Maintain separate assembly, rifting, separation and magmatism records.",
    "sources": [
      "S002",
      "S004"
    ]
  },
  {
    "id": "A028",
    "earlier_claim": "The western margin is related to continental breakup and tectono-magmatic processes.",
    "verdict": "supported_at_abstract_level",